[
  {
    "SchemaVersion": "1.0.0",
    "DataVersion": "2025-11-28",
    "Name": "Firebolt",
    "ID": "SPL_Firebolt",
    "SpellLevel": 0,
    "TypeTags": [
      "Spell.Damage",
      "Spell.Target"
    ],
    "SchoolReference": {
      "DataTable": "/Game/Data/SpellSchoolDataTable",
      "RowName": "SCH_Evocation"
    },
    "DamageTypeReference": {
      "DataTable": "/Game/Data/DamageTypeDataTable",
      "RowName": "DMG_Fire"
    },
    "Description": "You hurl a mote of fire at a creature or object within range. Make a ranged spell attack against the target. On a hit, the target takes 1d10 fire damage. A flammable object hit by this spell ignites if it isn't being worn or carried.",
    "SpellData": {
      "Range": "120",
      "CastingTime": "1 action",
      "Components": "V, S",
      "Duration": "Instantaneous",
      "Damage": "1d10",
      "Scaling": "1d10 per level above 1st"
    }
  },
  {
    "SchemaVersion": "1.0.0",
    "DataVersion": "2025-11-28",
    "Name": "Mage Hand",
    "ID": "SPL_MageHand",
    "SpellLevel": 0,
    "TypeTags": [
      "Spell.Buff"
    ],
    "SchoolReference": {
      "DataTable": "/Game/Data/SpellSchoolDataTable",
      "RowName": "SCH_Conjuration"
    },
    "DamageTypeReference": null,
    "Description": "A spectral, floating hand appears at a point you choose within range. The hand lasts for the duration or until you dismiss it as an action. The hand vanishes if it is ever more than 30 feet away from you or if you cast this spell again.",
    "SpellData": {
      "Range": "30",
      "CastingTime": "1 action",
      "Components": "V, S",
      "Duration": "1 minute"
    }
  },
  {
    "SchemaVersion": "1.0.0",
    "DataVersion": "2025-11-28",
    "Name": "Fireball",
    "ID": "SPL_Fireball",
    "SpellLevel": 3,
    "TypeTags": [
      "Spell.Damage",
      "Spell.Area"
    ],
    "SchoolReference": {
      "DataTable": "/Game/Data/SpellSchoolDataTable",
      "RowName": "SCH_Evocation"
    },
    "DamageTypeReference": {
      "DataTable": "/Game/Data/DamageTypeDataTable",
      "RowName": "DMG_Fire"
    },
    "Description": "A bright streak flashes from your pointing finger to a point you choose within range and then blossoms with a low roar into an explosion of flame. Each creature in a 20-foot-radius sphere centered on that point must make a Dexterity saving throw. A target takes 8d6 fire damage on a failed save, or half as much damage on a successful one.",
    "SpellData": {
      "Range": "150",
      "CastingTime": "1 action",
      "Components": "V, S, M",
      "Duration": "Instantaneous",
      "Damage": "8d6",
      "Area": "20-foot-radius sphere",
      "Scaling": "+1d6 per level above 3rd"
    }
  },
  {
    "SchemaVersion": "1.0.0",
    "DataVersion": "2025-11-28",
    "Name": "Magic Missile",
    "ID": "SPL_MagicMissile",
    "SpellLevel": 1,
    "TypeTags": [
      "Spell.Damage",
      "Spell.Target"
    ],
    "SchoolReference": {
      "DataTable": "/Game/Data/SpellSchoolDataTable",
      "RowName": "SCH_Evocation"
    },
    "DamageTypeReference": {
      "DataTable": "/Game/Data/DamageTypeDataTable",
      "RowName": "DMG_Force"
    },
    "Description": "You create three glowing darts of magical force. Each dart hits a creature of your choice that you can see within range. A dart deals 1d4+1 force damage to its target. The darts all strike simultaneously, and you can direct them to hit one creature or several.",
    "SpellData": {
      "Range": "120",
      "CastingTime": "1 action",
      "Components": "V, S",
      "Duration": "Instantaneous",
      "Damage": "1d4+1",
      "Missiles": "3",
      "Scaling": "+1 missile per level above 1st"
    }
  },
  {
    "SchemaVersion": "1.0.0",
    "DataVersion": "2025-11-28",
    "Name": "Healing Word",
    "ID": "SPL_HealingWord",
    "SpellLevel": 1,
    "TypeTags": [
      "Spell.Healing",
      "Spell.Target"
    ],
    "SchoolReference": {
      "DataTable": "/Game/Data/SpellSchoolDataTable",
      "RowName": "SCH_Evocation"
    },
    "DamageTypeReference": null,
    "Description": "A creature of your choice that you can see within range regains hit points equal to 1d4 + your spellcasting ability modifier. This spell has no effect on undead or constructs.",
    "SpellData": {
      "Range": "60",
      "CastingTime": "1 bonus action",
      "Components": "V",
      "Duration": "Instantaneous",
      "Healing": "1d4 + modifier",
      "Scaling": "+1d4 per level above 1st"
    }
  },
  {
    "SchemaVersion": "1.0.0",
    "DataVersion": "2025-11-28",
    "Name": "Shield",
    "ID": "SPL_Shield",
    "SpellLevel": 1,
    "TypeTags": [
      "Spell.Buff",
      "Spell.Defensive"
    ],
    "SchoolReference": {
      "DataTable": "/Game/Data/SpellSchoolDataTable",
      "RowName": "SCH_Abjuration"
    },
    "DamageTypeReference": null,
    "Description": "An invisible barrier of magical force appears and protects you. Until the start of your next turn, you have a +5 bonus to AC, including against the triggering attack, and you take no damage from magic missile.",
    "SpellData": {
      "Range": "Self",
      "CastingTime": "1 reaction",
      "Components": "V, S",
      "Duration": "1 round",
      "ACBonus": "5"
    }
  }
]